title,description,topic
Kamala Harris makes surprise appearance on SNL... Developing...,"Kamala Harris makes surprise appearance on SNL... Developing...          (Top headline, 1st story, link)              Related stories:MELTDOWN: THE DON SEETHING; THREATENS TO 'KNOCK PEOPLE OUT'...  VIDEO...  'MY BEAUTIFUL WHITE SKIN'...  SIMULATES ORAL SEX ON…",doing public show
Michigan Muslim Was Booted From a Kamala Harris Rally. Then Team Trump Asked Him to Star in a Campaign Ad.,Ahmed Ghanim said no thanks — but the ejection could be the kind of thing that drives Arab and Muslim voters to Trump. The post Michigan Muslim Was Booted From a Kamala Harris Rally. Then Team Trump Asked Him to Star in a Campaign Ad. appeared first on The In…,religion
Beyoncé is rallying with Kamala Harris in Houston. Will it make a difference?,"Celebrity endorsements probably don't make much of a difference, experts told BI, but in a historically tight race there could be caveats.",celebrity endorsement
"Economic concerns are top of voters' minds, but Kamala Harris is choosing a different path for her closing argument","Kamala Harris is betting voters can hear two messages at once, but she is leaning hard into anti-Trump attacks in the final weeks before Election Day.",campaign strategy
Cardi B To Join Kamala Harris At Milwaukee Rally,"Cardi B will make remarks at a Milwaukee rally with Kamala Harris on Friday, as the vice president’s campaign makes its final get-out-the-vote push ahead of Nov. 5. The event will feature performances by Gorilla, Flo Milli, MC Late, The Isley Brothers and DJ …",celebrity endorsement
"Leonardo DiCaprio Endorses Kamala Harris, Says Donald Trump “Continues To Deny The Facts” Of Climate Change","Leonardo DiCaprio endorsed Kamala Harris in a video posted to Instagram today, saying that her rival Donald Trump “continues to deny” the facts and science behind climate change. DiCaprio opened the video by noting that the devastating hurricanes that struck …",celebrity endorsement
Arnold Schwarzenegger Says He’s Voting For Kamala Harris And Tim Walz,"Arnold Schwarzenegger wrote on X today that he has voted for Kamala Harris and Tim Walz, saying that he “will always be an American before I am a Republican.” The former GOP California governor wrote, “Let me be honest with you: I don’t like either party righ…",celebrity endorsement
VP Hits ‘SNL’: Kamala Harris To Appear With Maya Rudolph On Last Show Before Election,"Saturday Night Live viewers are going to be seeing double tonight when it comes to the Vice President of the United States. Kamala Harris will be appearing on the NBC late night show on Saturday, Deadline can confirm from campaign sources. Making an unschedul…",public show
Sarah Jessica Parker Refers To “Childless Cat Lady” Character Carrie Bradshaw As She Endorses Kamala Harris,"Sarah Jessica Parker announced her endorsement of Kamala Harris in an Instagram post today that made reference to her Sex and the City character Carrie Bradshaw. She wrote, “For the climate, For hope, For friends and loved ones in the LGBTQ+ community, For fr…",celebrity endorsement
Eminem And Bruce Springsteen To Appear At Kamala Harris Rallies As Campaign Ramps Up Final Push,"Kamala Harris’ campaign is lining up a series of music giants to appear or perform at campaign events in the final weeks before election day. Eminem will introduce Barack Obama at an event in Detroit this evening, according to CNN. Bruce Springsteen will perf…",celebrity endorsement
"CNN’s Kamala Harris Town Hall Drew At Least 3.2 Million Viewers, Early Numbers Show","CNN’s town hall with Kamala Harris drew at least 3.2 million viewers, giving the network a big bounce from its regular audience in the 9 p.m. time period. The viewership likely will rise when final numbers come in later this afternoon. That figure is still we…",campaign statistics
LeBron James Endorses Kamala Harris In 2024 Presidential Race: “Hate Takes Us Back”,"NBA superstar LeBron James endorsed Kamala Harris for president, posting on Instagram that the “choice is clear” in the election. This afternoon, James posted a video of Donald Trump using extreme and violent rhetoric. The video also included a clip of comedi…",celebrity endorsement
“Disappointing”: Kamala Harris Comments On Washington Post And Los Angeles Times Decisions To Not Endorse,"With one week until the election, Kamala Harris called in to Charlamagne Tha God’s The Breakfast Club, and was asked about the decision by The Washington Post and the Los Angeles Times to not endorse a presidential candidate this cycle. “It’s disappointing, n…",endorsement
Joe Rogan Open To Kamala Harris Podcast Interview But Only If She Travels To Him,"Joe Rogan has said he “really” hopes he can make a podcast interview with Democrat Presidential candidate Kamala Harris happen, but he wants to set the terms of engagement. In a message on social media, Rogan wrote that Harris had “not passed on doing the pod…",public show
"Bad Bunny Backs Kamala Harris, Shares Video Of Her Talking About Her Plans For Puerto Rico","Bad Bunny, the Puerto Rican recording artist, is supporting Kamala Harris in the 2024 presidential election, as he shared a video of her plans for the U.S. territory. Benito Antonio Martínez Ocasio’s endorsement came as Donald Trump held a rally at Madison Sq…",celebrity endorsement
"This Week On The Campaign Trail: Kamala Harris Headlines CNN Town Hall, Donald Trump Goes To Madison Square Garden","Kamala Harris and Donald Trump will continue their media blitz this week, as they start to offer their closing campaign messages with just 15 days remaining. Here’s a glimpse at their schedules, with additional events and media appearances expected to be adde…",campaign schedule
Eminem Tells Rally Kamala Harris Will Protect Freedom Of Speech: “People Shouldn’t Be Afraid To Express Their Opinion”,"Eminem made brief remarks at a Kamala Harris rally in Detroit this evening, as he talked of fears that people have of retribution for expressing their opinion and his belief that she would protect freedom of speech. On stage to introduce former President Bara…",celebrity endorsement
The Last Word: Kamala Harris’ Closing Argument Ellipse Speech Bashes “Obsessed With Revenge” Donald Trump With One Week Until Election,"A week from today the first Election Night results will be just hours away, but tonight Kamala Harris plans to double down on her critique and contempt for Donald Trump in the very place where the former president riled up the MAGA mob to attack the Capitol o…",anti-trump
"‘The Avengers’ Reunite: Scarlett Johansson, Chris Evans & Robert Downey Jr. & More Marvel Stars Endorse Kamala Harris Against Donald Trump","Scarlett Johansson made a call and assembled The Avengers to defeat Donald Trump in the upcoming presidential election and vote for Kamala Harris. In a video shared by Mark Ruffalo, the Hulk in the Marvel Cinematic Universe, the actors expressed their support…",celebrity endorsement
"Jennifer Lopez, At Kamala Harris Rally, Says Donald Trump’s Madison Square Garden Event Offended “Humanity And Anyone Of Decent Character”","Jennifer Lopez made a passionate case for Kamala Harris at a Las Vegas rally tonight, while chiding Donald Trump for bringing a parade of speakers to a Madison Square Garden event earlier this week who made racist jokes and sexist remarks. Trump “has consiste…",celebrity endorsement
Donald Trump Tries To Command News Cycle With Lawsuit Against CBS Over Kamala Harris’ ’60 Minutes’ Interview,"In the waning days of the presidential campaign, Donald Trump has sued CBS over the way that 60 Minutes edited an interview with Kamala Harris. The lawsuit, filed in U.S. District Court in Amarillo, TX, seeks $10 billion in damages and is just the latest liti…",lawsuit
’60 Minutes’ Says Donald Trump Has Made False Claim That Its Kamala Harris Interview Was Deceitfully Edited,"After Donald Trump’s continued attacks, 60 Minutes issued a statement today in which pushed back on the former president’s claim that its interview with Kamala Harris was deceitfully edited. Trump has continuously blasted the show and CBS, even calling for th…",drama
"Donald Trump’s Madison Square Garden Rally Opens With Speakers Ranting About “F—ing Illegals,” Puerto Rico A “Floating Pile Of Garbage” And Kamala Harris As The “Antichrist”","Donald Trump’s rally today at Madison Square Garden was marked by an opening lineup of speakers who joked about Puerto Rico being a “floating pile of garbage,” ranted about “f—ing illegals” and declared that Kamala Harris was the “antichrist.” The extreme rhe…",public appearance
"Cardi B, At Kamala Harris Rally, Warns Of Donald Trump’s “Plan To Hustle You”; Rapper Says She Didn’t Plan To Vote Until VP Entered Race","Speaking at a rally for Kamala Harris tonight, Cardi B blasted Donald Trump as a “hustler” with a “plan to hustle you,” warning that he doesn’t “believe women deserve rights.” The rapper and songwriter also explained why she endorsed Harris, telling the Milwa…",celebrity endorsement
Kamala Harris Seizes On John Kelly’s “Fascist” Comments About Donald Trump In Effort To Make Story Resonate In A Fractured Media Landscape,"All three major cable news networks carried Vice President Kamala Harris’ brief remarks on the latest twist in the presidential campaign: John Kelly, Donald Trump’s former chief of staff, going on record via audio to say that the Republican nominee “certainly…",anti-trump
